Category,Initiative,Description,Benefits,Challenges,Metrics
Environmental,Carbon Footprint Reduction,Reducing greenhouse gas emissions,Climate impact mitigation; Cost savings,High upfront costs; Measurement complexity,CO2 emissions per unit; Energy consumption
Environmental,Renewable Energy,Transitioning to clean energy sources,Reduced emissions; Energy independence,Infrastructure investment; Reliability,Percentage renewable energy; Energy costs
Environmental,Waste Reduction,Minimizing waste generation and disposal,Cost savings; Environmental protection,Process changes; Employee training,Waste per unit produced; Recycling rate
Environmental,Water Conservation,Reducing water usage and improving efficiency,Cost savings; Resource preservation,Technology investment; Monitoring,Water usage per unit; Water recycling rate
Social,Employee Wellbeing,Promoting health and work-life balance,Productivity; Retention; Satisfaction,Program costs; Measurement difficulty,Employee satisfaction; Turnover rate
Social,Diversity and Inclusion,Creating inclusive workplace culture,Innovation; Talent attraction; Performance,Cultural change; Bias elimination,Diversity metrics; Inclusion scores
Social,Community Engagement,Supporting local communities and causes,Brand reputation; Social impact,Resource allocation; Impact measurement,Community investment; Volunteer hours
Social,Supply Chain Ethics,Ensuring ethical practices in supply chain,Risk mitigation; Brand protection,Monitoring complexity; Cost increases,Supplier audits; Compliance rate
Governance,Transparency,Open communication and reporting,Trust; Accountability; Compliance,Information management; Stakeholder expectations,Disclosure scores; Stakeholder feedback
Governance,Ethics and Compliance,Maintaining ethical standards and legal compliance,Risk mitigation; Reputation protection,Training costs; Monitoring complexity,Compliance rate; Ethics violations
Governance,Board Diversity,Diverse representation in governance,Better decision making; Stakeholder representation,Recruitment challenges; Cultural change,Board diversity metrics; Independence
Governance,Risk Management,Identifying and managing business risks,Business continuity; Stakeholder confidence,Resource requirements; Complexity,Risk assessment scores; Incident rate
Economic,Innovation Investment,Investing in R&D and new technologies,Competitive advantage; Growth opportunities,High costs; Uncertain returns,R&D spending; Innovation pipeline
Economic,Local Sourcing,Purchasing from local suppliers,Community support; Reduced transportation,Limited options; Potential cost increases,Local supplier percentage; Transportation costs
Economic,Circular Economy,Designing for reuse and recycling,Resource efficiency; Waste reduction,Design complexity; Infrastructure needs,Material recovery rate; Product lifecycle
Economic,Stakeholder Value,Creating value for all stakeholders,Long-term sustainability; Stakeholder support,Balancing interests; Measurement challenges,Stakeholder satisfaction; Value distribution